priority,opportunity_type,title,query_keyword,published,region,amount,source_name,source_url,summary,sales_angle,next_action
Medium,Direct,四川烟草商业系统2026年-2029年企业年金受托机构服务采购项目-公开招标公告_交易公开_国家公共资源交易平台,site:ggzy.gov.cn 中国烟草 招标公告,2026-06-09,,,Yahoo Search Fallback,https://www.ggzy.gov.cn/information/deal/html/a/0067/0101/20260609/0067a048d4ab9a624f0ba90c6330799a2054.html,该项目与烟草系统采购直接相关，命中检索词“site:ggzy.gov.cn 中国烟草 招标公告”。建议优先核对采购范围、报名截止时间、标书获取方式和投标资格要求。,建议当天联系采购代理与业主单位，优先判断是否属于烟草系统年度集采或专项建设采购。,先打开原公告，确认采购单位、项目范围、报名/投标截止时间，以及标书购买或下载路径。
Medium,Direct,秦皇岛烟草机械有限责任公司蒸汽管道改造项目-公开招标公告_交易公开_国家公共资源交易平台,site:ggzy.gov.cn 烟草公司 招标公告,2026-06-02,,,Yahoo Search Fallback,https://www.ggzy.gov.cn/information/deal/html/a/0067/0101/20260602/0067bee6ee5f84a244bf82d7372bdcd39f5c.html,该项目与烟草系统采购直接相关，命中检索词“site:ggzy.gov.cn 烟草公司 招标公告”。建议优先核对采购范围、报名截止时间、标书获取方式和投标资格要求。,建议当天联系采购代理与业主单位，优先判断是否属于烟草系统年度集采或专项建设采购。,先打开原公告，确认采购单位、项目范围、报名/投标截止时间，以及标书购买或下载路径。
Medium,Direct,深圳烟草工业有限责任公司2026年广东省市场推广项目-公开招标公告_交易公开_国家公共资源交易平台,site:ggzy.gov.cn 烟草公司 招标公告,2026-06-01,年广东省市,,Yahoo Search Fallback,https://www.ggzy.gov.cn/information/deal/html/a/0067/0101/20260601/0067ec0c8ace3728412686baa14f69dce9ca.html,该项目与烟草系统采购直接相关，命中检索词“site:ggzy.gov.cn 烟草公司 招标公告”。建议优先核对采购范围、报名截止时间、标书获取方式和投标资格要求。,建议当天联系采购代理与业主单位，优先判断是否属于烟草系统年度集采或专项建设采购。,先打开原公告，确认采购单位、项目范围、报名/投标截止时间，以及标书购买或下载路径。
Medium,Direct,河北省烟草公司沧州市公司经营业务用房及后勤设施修缮改造采购监理服务项目招标公告_交易公开_国家公共资源交易平台,site:ggzy.gov.cn 烟草公司 招标公告,2026-06-01,河北省烟草公司沧州市,,Yahoo Search Fallback,https://www.ggzy.gov.cn/information/deal/html/a/130000/0101/20260601/001317fe050e4c5c4ea1a8be7e808e1563b9.html,该项目与烟草系统采购直接相关，命中检索词“site:ggzy.gov.cn 烟草公司 招标公告”。建议优先核对采购范围、报名截止时间、标书获取方式和投标资格要求。,建议当天联系采购代理与业主单位，优先判断是否属于烟草系统年度集采或专项建设采购。,先打开原公告，确认采购单位、项目范围、报名/投标截止时间，以及标书购买或下载路径。
Medium,Direct,广东烟草潮州市有限责任公司2026年网络安全运维服务及安全设备采购项目-公开招标公告_交易公开_国家公共资源交易平台,site:ggzy.gov.cn 烟草公司 招标公告,2026-06-01,广东烟草潮州市,,Yahoo Search Fallback,https://www.ggzy.gov.cn/information/deal/html/a/0067/0101/20260601/00676b9a31d8a7cb4e3197d71a6d997f1f60.html,该项目与烟草系统采购直接相关，命中检索词“site:ggzy.gov.cn 烟草公司 招标公告”。建议优先核对采购范围、报名截止时间、标书获取方式和投标资格要求。,建议当天联系采购代理与业主单位，优先判断是否属于烟草系统年度集采或专项建设采购。,先打开原公告，确认采购单位、项目范围、报名/投标截止时间，以及标书购买或下载路径。
Medium,Direct,广东烟草汕尾市有限公司档案密集柜采购项目-中标候选人公示_交易公开_国家公共资源交易平台,site:ggzy.gov.cn 中国烟草 招标公告,2026-05-18,广东烟草汕尾市,,Yahoo Search Fallback,https://www.ggzy.gov.cn/information/deal/html/a/0067/0104/20260609/006783b85493309f4cd8adefca17fdaf4f3c.html,该项目与烟草系统采购直接相关，命中检索词“site:ggzy.gov.cn 中国烟草 招标公告”。建议优先核对采购范围、报名截止时间、标书获取方式和投标资格要求。,建议当天联系采购代理与业主单位，优先判断是否属于烟草系统年度集采或专项建设采购。,先打开原公告，确认采购单位、项目范围、报名/投标截止时间，以及标书购买或下载路径。
Medium,Direct,山东省政府采购网 https://ggzyjyzx.shandong.gov.cn › art › 2026/5/14 山东省公共资源交易中心 招标公告 [招标公告]山东将军烟草新材料科技...,site:gov.cn 烟草机械 招标公告,,山东省,,Yahoo Search Fallback,https://ggzyjyzx.shandong.gov.cn/art/2026/5/14/art_347674_11262568.html,该项目与烟草系统采购直接相关，命中检索词“site:gov.cn 烟草机械 招标公告”。建议优先核对采购范围、报名截止时间、标书获取方式和投标资格要求。,建议当天联系采购代理与业主单位，优先判断是否属于烟草系统年度集采或专项建设采购。,先打开原公告，确认采购单位、项目范围、报名/投标截止时间，以及标书购买或下载路径。
